id;title;score;num_comments;url
1noqbhr;Charlie Kirk was a divisive far-right podcaster. Why is he being rebranded as a national hero?;15251;1472;https://www.theguardian.com/commentisfree/2025/sep/23/charlie-kirk-bigoted-far-right-podcaster
1nok4av;Trump's big UN speech received with awkward laughter in embarrassing backfire;21621;1430;https://inews.co.uk/news/world/trumps-big-un-speech-received-with-awkward-laughter-in-embarrassing-backfire-3933958
1nonj9g;Unlike other Dems, AOC refuses to join in whitewashing of Kirk;9587;419;https://www.peoplesworld.org/article/unlike-other-dems-aoc-refuses-to-join-in-whitewashing-of-charlie-kirk/
1noifii;Trump cancels meeting with Democratic leaders ahead of government shutdown deadline;11089;944;https://www.cnn.com/2025/09/23/politics/trump-cancels-meeting-democrats-shutdown
1nonmq2;Donald and Melania Trump get stuck on broken escalator at UN prompting rant to General Assembly;4645;459;https://www.the-independent.com/tv/news/donald-trump-un-broken-escalator-b2832112.html
1nokc1y;Trump Is Running “the Most Corrupt Administration in U.S. History”;6492;186;https://newrepublic.com/article/200790/greg-casar-homan-trump-corruption
1nofipg;"Nintendo Alerted After DHS Uses Pokémon to Promote ICE Raids | 
A video captioned “Gotta Catch ’Em All” spliced raid footage with Pokémon imagery, sparking calls for Nintendo to step in.";13857;699;https://www.thedailybeast.com/nintendo-alerted-after-dhs-uses-pokemon-to-promote-ice-raids-tearing-families-apart/
1nogovl;Republican Physician Immediately Trashes Trump’s Autism Claim;9429;327;https://www.thedailybeast.com/republican-physician-immediately-trashes-trumps-autism-claim/
1noh77y;Kamala Harris gives Zohran Mamdani a tepid endorsement: 'I endorse the Democrat in the race';8421;1960;https://www.nbcnews.com/politics/kamala-harris/kamala-harris-gives-zohran-mamdani-tepid-endorsement-endorse-democrat-rcna233135?cid=sm_npd_nn_tw_ma&taid=68d29b87945e7c000110f8c8&utm_campaign=trueanthem&utm_medium=social&utm_source=twitter
1nokuz3;Scientist behind Trump’s Tylenol claims was paid to give evidence against drug maker;3344;148;https://www.thetimes.com/article/aa7fff5a-d267-440f-a544-a3cd75c33416
1nohzb8;Mike Johnson’s Epstein Delay Tactic Is About to Blow Up in His Face;4004;162;https://newrepublic.com/post/200787/mike-johnson-epstein-bill-arizona-special-election?utm_source=Twitter&utm_campaign=SF_TNR&utm_medium=social&utm_term=Autofeed
1nohnnj;Leavitt Busted Telling Untruths About Homan’s $50K Sting;4146;247;https://www.thedailybeast.com/karoline-leavitt-busted-telling-untruths-about-tom-homans-50k-sting/?09232025
1nohfv5;Harris on Trump: ‘We’re dealing with a communist dictator’;3592;1062;https://thehill.com/homenews/campaign/5517232-kamala-harris-donald-trump-tyrant-private-sector/
1nolfhq;Trump, Epstein Hold Hands In Statue Send-Up;1961;33;https://www.huffpost.com/entry/donald-trump-jeffrey-epstein-holding-hands-statue_n_68d2ba98e4b06a8b846e409a
1nom0c8;Trump refuses to meet with ‘Radical Left Democrats’ Schumer and Jeffries. Republicans need them to avert a shutdown;1652;294;https://www.independent.co.uk/news/world/americas/us-politics/trump-democrats-government-shutdown-schumer-b2832047.html
1nol7cl;Trump, 79, Whines About UN’s Escalator and Teleprompter in Bonkers Rant;1634;168;https://www.thedailybeast.com/trump-79-whines-about-uns-escalator-and-teleprompter-in-bonkers-rant/
1nor308;Mysterious new statue of Epstein and Trump holding hands appears on the National Mall;795;30;https://www.independent.co.uk/news/world/americas/us-politics/epstein-trump-statue-national-mall-b2832122.html
1nodtm5;UK Tells Patients ‘Don’t Pay Attention’ to Trump on Tylenol;3508;156;https://www.bloomberg.com/news/articles/2025-09-23/uk-tells-patients-don-t-pay-attention-to-trump-on-tylenol
1noj5b0;She Fought the Far Right Online for Years. Now She Wants to Do It in Congress;1424;66;https://www.wired.com/story/kat-abughazaleh-youtuber-for-congress/
1not5nj;Scientist behind Trump’s Tylenol claims was paid $150K to give evidence against drug maker;391;28;https://www.thetimes.com/us/american-politics/article/autism-scientist-tesitify-andrea-baccarelli-havard-aceraminophen-paracetamol-wvvzznhsf
